<?xml version="1.0" ?>
<xsd:schema xmlns: xs="http://www.w3.org/2001/XMLSchema">

	<xsd:complexType name="nodeType">
		<xsd:attribute name="id" type="xs:string" />
		<xsd:sequence>
			<xsd:element name="title" type="xsd:string" />
			<xsd:element name="location" type="xsd:string" />
			<xsd:element name="comment" type="xsd:string" minOccurs="0" />
			<xsd:element name="node" type="nodeType" minOccurs="0" maxOccurs="unbounded" />
		</xsd:sequence>
	</xsd:complexType> 
	
	<xsd:element name="momrtgt" type="nodeType" />
	
</xsd:schema>
